{
  "metadata": {
    "version": "1.1.0",
    "product": { "name": "vSphere", "vendor_name": "VMware" },
    "logged_time": 1750000100500,
    "original_format": "api"
  },
  "class_uid": 6003,
  "category_uid": 6,
  "activity_id": 4,
  "type_uid": 600304,
  "severity_id": 5,
  "time": 1750000100000,
  "status": "Success",
  "message": "VM prod-db-07 deleted via API by svc_orchestrator",
  "src_endpoint": { "ip": "172.16.5.9", "hostname": "vcenter-01", "port": 443 },
  "dst_endpoint": { "hostname": "prod-db-07" },
  "actor": { "user": { "name": "svc_orchestrator" } },
  "siem": { "sector": "datacenter", "source_type": "vmware_vsphere", "ingest_id": "22222222-2222-2222-2222-222222222222" }
}
